{
  "$id": "https://github.com/modbus2mqtt/proxmoxlxcinstaller/application",
 "$schema": "http://json-schema.org/draft-07/schema#",
  "type": "object",
  "properties": {
    "name": { "type": "string" },
    "description": { "type": "string" },
    "icon": { "type": "string", "default": "icon.png" },
    "installation": {"$ref": "#/$defs/templates"},
    "backup": { "$ref": "#/$defs/templates"},
    "restore": { "$ref": "#/$defs/templates"},
    "uninstall": { "$ref": "#/$defs/templates"},
    "update": { "$ref": "#/$defs/templates"},
    "upgrade": { "$ref": "#/$defs/templates"}
  },
   "$defs": {
    "templates": {
      "type": "array",
      "items": {
        "type": "string"
      }
    }
  }
}
