{
  "name": "Node-RED",
  "description": "Node-RED is a flow-based programming tool for wiring together hardware devices, APIs and online services",
  "icon": "icon.svg",
  "installation": [
    "set-parameters.json",
    "120-mount-disk-on-host.json",
    "010-get-latest-os-template.json",
    "100-create-configure-lxc.json",
    "200-start-lxc.json",
    "210-wait-for-container-ready.json",
    "160-bind-multiple-volumes-to-lxc.json",
    "330-install-packages.json",
    "340-install-node-application.json",
    "350-create-enable-service.json"
  ]
}

